12/31/21,
RSSD9001,RSSD ID
RSSD9999,Reporting Quarter
RSSD9007,DATE START
RSSD9008,DATE END
RSSD9132,PRIMARY ACTIVITY CODE
RSSD9032,FEDERAL RESERVE REGULATORY DISTRICT CODE
RSSD9146,BANK COUNT
BHBC3368,QUARTERLY AVERAGE OF TOTAL ASSETS
BHBC3402,QUARTERLY AVERAGE OF EARNING ASSETS
BHBC3516,QUARTERLY AVERAGES OF LOANS AND LEASES
BHBC3519,QUARTERLY AVERAGE OF EQUITY CAPITAL
BHBC4070,INCOME FROM FIDUCIARY ACTIVITIES
BHBC4073,TOTAL INTEREST EXPENSE
BHBC4074,NET INTEREST INCOME
BHBC4079,TOTAL NONINTEREST INCOME
BHBC4091,GAINS (LOSSES) ON SECURITIES NOT HELD IN TRADING ACCOUNTS
BHBC4093,TOTAL NONINTEREST EXPENSE
BHBC4094,INTEREST AND FEES ON LOANS AND LEASE FINANCING RECEIVABLES
BHBC4107,TOTAL INTEREST INCOME
BHBC4135,SALARIES AND EMPLOYEE BENEFITS
BHBC4218,INTEREST AND DIVIDEND INCOME ON SECURITIES
BHBC4301,INCOME (LOSS) BEFORE INCOME TAXES AND EXTRAORDINARY ITEMS AND OTHER ADJUSTMENTS
BHBC4302,APPLICABLE INCOME TAXES
BHBC4340,NET INCOME (LOSS)
BHBC4421,NET INTEREST EXPENSE ON DEPOSITS
BHBC4475,CASH DIVIDEND DECLARED - EQUITY CAPITAL
BHBC4484,MINORITY INTEREST
BHBC4519,NET INTEREST INCOME ON A FULLY TAXABLE EQUIVALENT BASIS
BHBC6061,LOANS CHARGED OFF AND RECOVERIES: TOTAL LOANS CHARGED OFF & RECOVERIES NET CHARGE-OFFS
BHBCA220,TRADING REVENUE
BHBCB490,"INVESTMENT BANKING, ADVISORY, BROKERAGE, AND UNDERWRITING FEES AND COMMISSIONS"
BHBCB491,VENTURE CAPITAL REVENUE
BHBCB493,NET SECURITIZATION INCOME
BHBCB494,INSURANCE COMMISSIONS AND FEES
BHBCC216,GOODWILL IMPAIRMENT LOSSES
BHBCJJ33,#N/A
RSSD9045,BHC INDICATOR
BHCA2170,#N/A
BHCA3792,TOTAL CAPITAL (SUM OF ITEMS 26 AND 34.A)
BHCA5310,ALLOWANCE FOR LOAN AND LEASE LOSSES INCLUDABLE IN TIER 2 CAPITAL
BHCA5311,"TIER 2 CAPITAL (GREATER OF ITEM 32.A MINUS ITEM 33, OR ZERO)"
BHCA7204,TIER 1 LEVERAGE RATIO (ITEM 26 DIVIDED BY ITEM 39)
BHCA7205,TOTAL CAPITAL RATIO (ITEM 35.A DIVIDED BY ITEM 40.A)
BHCA7206,TIER 1 CAPITAL RATIO (ITEM 26 DIVIDED BY ITEM 40.A)
BHCA8274,TIER 1 CAPITAL (SUM OF ITEMS 19 AND 25)
BHCAA223,TOTAL RISK-WEIGHTED ASSETS
BHCAA224,TOTAL ASSETS FOR THE LEVERAGE RATIO (ITEM 36 MINUS ITEMS 37 AND 38)
BHCAB530,ACCUMULATED OTHER COMPREHENSIVE INCOME (AOCI)
BHCAB596,OTHER DEDUCTIONS FROM (ADDITIONS TO) ASSETS FOR LEVERAGE RATIO PURPOSES
BHCAH036,#N/A
BHCAH311,INSTITUTION-SPECIFIC CAPITAL BUFFER NECESSARY TO AVOID LIMITATIONS ON DISTRIBUTIONS AND DISCRETIONARY BONUS PAYMENTS: CAPTIAL CONSERVATION BUFFER
BHCAH313,#N/A
BHCAH314,#N/A
BHCAJJ29,"TO BE COMPLETED ONLY BY INST THAT HAVE ADOPTED ASU 2016-13: DOES YOUR INSTITUTION HAVE A CECL TRANSITION ELECTION IN EFFECT AS OF THE QTR-END REPORT DATE? (""1"" FOR YES; ENTER ""0"" FOR NO.)"
BHCAKW00,RETAINED EARNINGS
BHCAKW03,AVERAGE TOTAL CONSOLIDATED ASSETS
BHCAKX77,#N/A
BHCAKX78,#N/A
BHCAKX79,#N/A
BHCAKX80,#N/A
BHCAKX81,#N/A
BHCAKX82,#N/A
BHCAKX83,#N/A
BHCALB58,"Less: Investments in the capital of unconsolidated financial institutions, net of associated DTLs, that exceed the 25 percent of line 12"
BHCALB59,"Less: MSAs, net of associated DTLs, that exceed 25 percent of line 12"
BHCALB60,"LESS: DTAs arising from temporary differences that could not be realized through net operating loss carrybacks, net of related valuation allowances and net of DTLs that exceed the 25 percent of line 12."
BHCALB61,#N/A
BHCALE74,Do you qualify for and opt-in to CBLR?
BHCALE85,#N/A
BHCALE86,#N/A
BHCALE87,#N/A
BHCALE88,#N/A
BHCALE89,#N/A
BHCALE90,#N/A
BHCALE91,#N/A
BHCALE92,#N/A
BHCALF21,#N/A
BHCALF22,#N/A
BHCALF23,#N/A
BHCALF24,#N/A
BHCALF25,#N/A
BHCALF27,#N/A
BHCALF28,#N/A
BHCAMK66,#N/A
BHCAMK76,#N/A
BHCAMK77,#N/A
BHCAMK78,#N/A
BHCANC99,#N/A
BHCAP742,"COMMON STOCK PLUS RELATED SURPLUS, NET OF TREASURY STOCK AND UNEARNED EMPLOYEE STOCK OWNERSHIP PLAN (ESOP) SHARES"
BHCAP793,COMMON EQUITY TIER 1 CAPITAL RATIO (ITEM 19 DIVIDED BY ITEM 40.A)
BHCAP838,"AOCI OPT-OUT ELECTION (ENTER ""1"" FOR YES; ENTER ""0"" FOR NO.)"
BHCAP839,COMMON EQUITY TIER 1 MINORITY INTEREST INCLUDABLE IN COMMON EQUITY TIER 1 CAPITAL
BHCAP840,COMMON EQUITY TIER 1 CAPITAL BEFORE ADJUSTMENTS AND DEDUCTIONS (SUM OF ITEMS 1 THROUGH 4)
BHCAP841,GOODWILL NET OF ASSOCIATED DEFERRED TAX LIABILITIES (DTLS)
BHCAP842,"INTANGIBLE ASSETS (OTHER THAN GOODWILL AND MORTGAGE SERVICING ASSETS (MSAS)), NET OF ASSOCIATED DTLS"
BHCAP843,"DEFERRED TAX ASSETS (DTAS) THAT ARISE FROM NET OPERATING LOSS AND TAX CREDIT CARRYFORWARDS, NET OF ANY RELATED VALUATION ALLOWANCES AND NET OF DTLS"
BHCAP844,"LESS: NET UNREALIZED GAINS (LOSSES) ON AFS SECURITIES (IF A GAIN, REPORT AS A POSITIVE VALUE; IF A LOSS, REPORT AS A NEGATIVE VALUE)"
BHCAP846,"ACCUMULATED NET GAINS (LOSSES)ON CASH-FLOW HEDGES (IF A GAIN, REPORT AS A POSITIVE VALUE; IF A LOSS, REPORT AS A NEGATIVE VALUE)"
BHCAP847,LESS: AMOUNTS RECORDED IN AOCI ATTRIBUTED TO DEFINED BENEFIT POSTRETIREMENT PLANS RESULTING FROM THE INITIAL AND SUBSEQUENT APPL OF THE RELEVANT GAAP STANDARDS THAT PERTAIN TO SUCH PLANS
BHCAP848,"LESS: NET UNREALIZED GAINS (LOSSES) ON HELD-TO-MATURITY SECURITIES THAT ARE INCLUDED IN AOCI (IF A GAIN, REPORT AS A POSITIVE VALUE; IF A LOSS, REPORT AS A NEGATIVE VALUE)"
BHCAP849,#N/A
BHCAP850,OTHER DEDUCTIONS FROM (ADDITIONS TO) COMMON EQUITY TIER 1 CAPTIAL BEFORE THRESHOLD-BASED DEDUCTIONS:ALL OTHER DEDUCTIONS FROM (ADDITIONS TO) COMMON EQUITY TIER 1 CAPITAL BEFORE THRESHOLD-BASED DEDUCTI
BHCAP852,SUBTOTAL OF COMMON EQUITY TIER 1 CAPITAL (ITEM 5 MINUS ITEMS 6 THROUGH 11)
BHCAP857,DEDUCTIONS APPLIED TO COMMON EQUITY TIER 1 CAPITAL DUE TO INSUFFICIENT AMOUNTS OF ADDITIONAL TIER 1 CAPITAL AND TIER 2 CAPITAL TO COVER DEDUCTIONS
BHCAP858,TOTAL ADJUSTMENTS AND DEDUCTIONS FOR COMMON EQUITY TIER 1 CAPITAL (SUM OF ITEMS 13 THROUGH 17)
BHCAP859,COMMON EQUITY TIER 1 CAPITAL (ITEM 12 MINUS ITEM 18)
BHCAP860,ADDITIONAL TIER 1 CAPITAL INSTRUMENTS PLUS RELATED SURPLUS
BHCAP861,NON-QUALIFYING CAPITAL INSTRUMENTS SUBJECT TO PHASE OUT FROM ADDITIONAL TIER 1 CAPITAL
BHCAP862,TIER 1 MINORITY INTEREST NOT INCLUDED IN COMMON EQUITY TIER 1 CAPITAL
BHCAP863,"ADDITIONAL TIER 1 CAPITAL BEFORE DEDUCTIONS (SUM ITEMS 20, 21, AND 22)"
BHCAP864,ADDITIONAL TIER 1 CAPITAL DEDUCTIONS
BHCAP865,"ADDITIONAL TIER 1 CAPITAL (GREATER OF ITEM 23 MINUS ITEM 24, OR ZERO)"
BHCAP866,TIER 2 CAPITAL INSTRUMENTS PLUS RELATED SURPLUS
BHCAP867,NON-QUALIFYING CAPITAL INSTRUMENTS SUBJECT TO PHASE OUT FROM TIER 2 CAPITAL
BHCAP868,TOTAL CAPITAL MINORITY INTEREST THAT IS NOT INCLUDED IN TIER 1 CAPITAL
BHCAP870,"TIER 2 CAPITAL BEFORE DEDUCTIONS (SUM OF ITEMS 27 THROUGH 30.A, PLUS ITEM 31)"
BHCAP872,TIER 2 CAPITAL DEDUCTIONS
BHCAP875,"DEDUCTIONS FROM COMMON EQUITY TIER 1 CAPITAL AND ADDITIONAL TIER 1 CAPITAL (SUM OF ITEMS 6, 7, 8, 10.B, 11, 13 THROUGH 17, AND ITEM 24)"
BHCAQ258,OTHER DEDUCTIONS FROM (ADDITIONS TO) COMMON EQUITY TIER 1 CAPTIAL BEFORE THRESHOLD-BASED DEDUCTIONS: UNREALIZED NET GAIN (LOSS) RELATED TO CHANGES IN THE FAIR VALUE OF LIABILITIES THAT ARE DUE TO CHAN
BHCAS540,#N/A
BHCB2210,NONINTEREST-BEARING BALANCES (BHC CONSOL. COMML. BANKS)
BHCB2389,MONEY MARKET DEPOSIT ACCOUNTS AND OTHER SAVINGS ACCOUNTS (BHC CONSOL. COMML. BANKS)
BHCB3187,"INTEREST-BEARING DEMAND DEPOSITS, NOW, ATS, AND OTHER TRANSACTION ACCOUNTS (BHC CONSOL. COMML. BANKS)"
BHCBHK29,"TIME DEPOSITS $250,000 OR LESS (BHC CONSOL. COMML. BANKS) (BHC CONSOL. COMML. BANKS)"
BHCBJ474,"TIME DEPOSITS $250,000+ (BHC CONSOL. COMML. BANKS) (BHC CONSOL. COMML. BANKS)"
BHCK0081,NONINTEREST BEARING BALANCES AND CURRENCY AND COIN DUE FROM DEPOSITORY INSTITUTIONS (BHC CONSOLIDATED)
BHCK0211,"U.S. TREASURY SECURITIES, HELD TO MATURITY, AMORTIZED COST (BHC CONSOLIDATED)"
BHCK0213,"U.S. TREASURY SECURITIES, HELD TO MATURITY, FAIR VALUE (BHC CONSOLIDATED)"
BHCK0383,DEBT SECURITIES WITH REMAINING MATURITY OF 1 YEAR OR LESS (BHC CONSOLIDATED)
BHCK0384,DEBT SECURITIES WITH REMAINING MATURITY OF 1-5 YEARS (BHC CONSOLIDATED)
BHCK0387,DEBT SECURITIES WITH REMAINING MATURITY OF 5+ YEARS (BHC CONSOLIDATED)
BHCK0395,INT-BEARING BALANCES IN U.S. OFFICES (BHC CONSOLIDATED)
BHCK0397,INTEREST-BEARING BALANCES IN FOREIGN OFFICES (BHC CONSOLIDATED)
BHCK0416,PLEDGED SECURITIES (BHC CONSOLIDATED)
BHCK0497,OTHER NONINTEREST EXPENSE: ADVERTISING AND MARKETING EXPENSES (BHC CONSOLIDATED)
BHCK1286,"U.S. TREASURY SECURITIES, AVAILABLE FOR SALE, AMORTIZED COST (BHC CONSOLIDATED)"
BHCK1287,"U.S. TREASURY SECURITIES, AVAILABLE FOR SALE, FAIR VALUE (BHC CONSOLIDATED)"
BHCK1288,LOANS TO DEPOSITORY INSTITUTIONS
BHCK1292,LOANS TO U.S. BANKS AND OTHER U.S. DEPOSITORY INSTITUTIONS (BHC CONSOLIDATED)
BHCK1296,LOANS TO FOREIGN BANKS (BHC CONSOLIDATED)
BHCK1403,NONACCRUAL: TOTAL LOANS AND LEASES (BHC CONSOLIDATED)
BHCK1406,PAST DUE 30 THROUGH 89 DAYS AND STILL ACCRUING: TOTAL LOANS AND LEASES (BHC CONSOLIDATED)
BHCK1407,PAST DUE 90 DAYS OR MORE AND STILL ACCRUING: TOTAL LOANS AND LEASES (BHC CONSOLIDATED)
BHCK1410,LOANS SECURED BY REAL ESTATE (BHC CONSOLIDATED)
BHCK1545,LOANS FOR PURCHASING AND CARRYING SECURITIES (SECURED AND UNSECURED): CONSOLIDATED (BHC CONSOLIDATED)
BHCK1583,"LOANS TO FARMERS, NONACCRUAL (BHC CONSOLIDATED)"
BHCK1590,LOANS TO FINANCE AGRICULTURAL PRODUCTION AND OTHER LOANS TO FARMERS (BHC CONSOLIDATED)
BHCK1594,"LN TO FRMERS,PAST 30-89 DYS, ACCRUING (BHC CONSOLIDATED)"
BHCK1597,"LN TO FRMERS,PAST 90 OR MORE,ACCRUING (BHC CONSOLIDATED)"
BHCK1606,"C&I LN PAST DUE 30-89 DAYS, ACCRUING (BHC CONSOLIDATED)"
BHCK1607,"C&I LN PAST DUE 90 OR MORE, ACCRUING (BHC CONSOLIDATED)"
BHCK1608,"C&I LOANS, NONACCRUAL (BHC CONSOLIDATED)"
BHCK1737,"OTHER DOMESTIC DEBT SECURITIES, H-T-M, AMORTIZED COST (BHC CONSOLIDATED)"
BHCK1738,"OTHER DOMESTIC DEBT SECURITIES, H-T-M, FAIR VALUE (BHC CONSOLIDATED)"
BHCK1739,"OTHER DOMESTIC DEBT SECURITIES, A-F-S, AMORTIZED COST (BHC CONSOLIDATED)"
BHCK1741,"OTHER DOMESTIC DEBT SECURITIES, A-F-S, FAIR VALUE (BHC CONSOLIDATED)"
BHCK1742,"FOREIGN DEBT SECURITIES, H-T-M, AMORTIZED COST (BHC CONSOLIDATED)"
BHCK1743,"FOREIGN DEBT SECURITIES, H-T-M, FAIR VALUE (BHC CONSOLIDATED)"
BHCK1744,"FOREIGN DEBT SECURITIES, A-F-S, AMORTIZED COST (BHC CONSOLIDATED)"
BHCK1746,"FOREIGN DEBT SECURITIES, A-F-S, FAIR VALUE (BHC CONSOLIDATED)"
BHCK1752,"OTHER ASSETS, EQUITY INVESTMENTS WITHOUT DETERMINABLE FAIR VALUES (BHC CONSOLIDATED)"
BHCK1754,AMORTIZED COST:  TOTAL (SUM OF 1 THROUGH 7)
BHCK1763,COMMERCIAL AND INDUSTRIAL LOANS TO U.S. ADDRESSEES (DOMICILE) (BHC CONSOLIDATED)
BHCK1764,COMMERCIAL AND INDUSTRIAL LOANS TO NON-U.S. ADDRESSEES (DOMICILE) (BHC CONSOLIDATED)
BHCK1766,COMMERCIAL AND INDUSTRIAL LOANS
BHCK1771,"TOTAL HELD-TO-MATURITY SECURITIES, FAIR VALUE (BHC CONSOLIDATED)"
BHCK1772,"TOTAL AVAILABLE-FOR-SALE SECURITIES, AMORTIZED COST (BHC CONSOLIDATED)"
BHCK1773,"SECURITIES: AVAILABLE FOR SALE, FAIR VALUE (BHC CONSOLIDATED)"
BHCK1778,AMORTIZED COST OF HELD-TO-MATURITY SECURITIES SOLD OR TRANSFERRED TO AVAILABLE-FOR-SALE OR TRADING SECURITIES DURING THE CALENDAR YEAR-TO-DATE
BHCK1912,"LOANS AND LEASES INCLUDED IN ITEMS 1422, 1607, 5378, 5381, 5384, 5387, 5390, 5460, AND 1227 EXTENDED TO NON-U.S. ADDRESSEES THAT ARE PAST DUE 90 DAYS OR MORE AND STILL ACCRUING"
BHCK1913,"NONACCRUAL LOANS AND LEASES INCLUDED IN ITEMS 1423, 1608, 5379, 5382, 5385, 5388, 5391, 5461, AND 1228 EXTENDED TO NON-U.S. ADDRESSEES"
BHCK1975,"LOANS TO INDIVIDUALS FOR HOUSEHOLD, FAMILY, AND OTHER PERSONAL EXPENDITURES"
BHCK2081,LOANS TO FOREIGN GOVERNMENTS AND OFFICIAL INSTITUTIONS (BHC CONSOLIDATED)
BHCK2122,TOAL LOANS AND LEASES HELD FOR INVESTMENT AND HELD FOR SALE (BHC CONSOLIDATED)
BHCK2123,UNEARNED INCOME ON LOANS (BHC CONSOLIDATED)
BHCK2130,INVESTMENTS IN UNCONSOLIDATED SUBSIDIARIES AND ASSOCIATED COMPANIES (BHC CONSOLIDATED)
BHCK2143,INTANGIBLE ASSETS (FROM SCHEDULE HC-M)
BHCK2145,"PREMISES AND FIXED ASSETS, INCLUDING CAPITAL LEASES (BHC CONSOLIDATED)"
BHCK2148,"OTHER ASSETS, NET DEFERRED TAX ASSETS (BHC CONSOLIDATED)"
BHCK2150,TOTAL OTHER REAL ESTATE OWNED (BHC CONSOLIDATED)
BHCK2160,OTHER ASSETS (BHC CONSOLIDATED)
BHCK2165,LEASE FINANCING RECEIVABLES (NET OF UNEARNED INCOME)
BHCK2168,"OTHER ASSETS, OTHER (BHC CONSOLIDATED)"
BHCK2170,TOTAL ASSETS (BHC CONSOLIDATED)
BHCK2309,COMMERCIAL PAPER (BHC CONSOLIDATED)
BHCK2332,OTHER BORROWED MONEY WITH A REMAINING MATURITY OF 1 YR OR LESS (BHC CONSOLIDATED)
BHCK2333,OTHER BORROWED MONEY WITH A REMAINING MATURITY OF > 1 YEAR (BHC CONSOLIDATED)
BHCK2635,ALL OTHER BORROWED MONEY (QTRLY AVG) (BHC CONSOLIDATED)
BHCK2746,"LNS TO FINC COMMCL RE,CONSTRC&LD DEV (BHC CONSOLIDATED)"
BHCK2750,OTHER LIABILITIES (BHC CONSOLIDATED)
BHCK2948,TOTAL LIABILITIES (BHC CONSOLIDATED)
BHCK3000,NONCONTROLLING (MINORITY) INTERESTS IN CONSOLIDATED SUBSIDIARIES (BHC CONSOLIDATED)
BHCK3049,"OTHER LIABILITIES, NET DEFERRED TAX LIABILITIES (BHC CONSOLIDATED)"
BHCK3123,ALLOWANCE FOR LOANS AND LEASE LOSSES (BALANCE AT END OF PERIOD) (BHC CONSOLIDATED)
BHCK3128,ALLOCATED TRANSFER RISK RESERVE (BALANCE AT END OF PERIOD) (BHC CONSOLIDATED)
BHCK3163,GOODWILL (BHC CONSOLIDATED)
BHCK3164,MORTGAGE SERVICING ASSETS (BHC CONSOLIDATED)
BHCK3190,OTHER BORROWED MONEY (BHC CONSOLIDATED)
BHCK3196,REALIZED GAINS (LOSSES) ON AVAILABLE-FOR-SALE SECURITIES (BHC CONSOLIDATED)
BHCK3197,EARNING ASSETS THAT ARE REPRICEABLE WITHIN 1 YEAR OR MATURE WITHIN 1 YEAR (BHC CONSOLIDATED)
BHCK3210,TOTAL BANK HOLDING COMPANY EQUITY CAPITAL (BHC CONSOLIDATED)
BHCK3217,TOTAL BANK HOLDING COMPANY EQUITY CAPITAL MOST RECENTLY REPORTED FOR THE END OF PREVIOUS CALENDAR YEAR (BHC CONSOLIDATED)
BHCK3230,COMMON STOCK (BHC CONSOLIDATED)
BHCK3240,SURPLUS (BHC CONSOLIDATED)
BHCK3247,UNDIVIDED PROFITS & CAPITAL RESERVES (BHC CONSOLIDATED)
BHCK3283,PERPETUAL PREFERRED STOCK (BHC CONSOLIDATED)
BHCK3296,VAR RT INT-BRG DEPS RPRIC OR MAT 1YR (BHC CONSOLIDATED)
BHCK3298,"LONG-TERM DEBT THAT REPRICES WITHIN ONE YEAR INCLUDED IN ITEMS 16 AND 19A ON SCHEDULE HC, BALANCE SHEET (BHC CONSOLIDATED)"
BHCK3300,"TOT LIAB, RESERVE & CAPITAL ACCOUNTS (BHC CONSOLIDATED)"
BHCK3353,FEDERAL FUNDS PURCHASED AND SECURITIES SOLD UNDER AGREEMENTS TO REPURCHASE (QTRLY AVG) (BHC CONSOLIDATED)
BHCK3365,FEDERAL FUNDS SOLD AND SECURITIES PURCHASED UNDER AGREEMENT TO RESELL (QTRLY AVG) (BHC CONSOLIDATED)
BHCK3368,QTLY AVG OF TOTAL ASSETS (BHC CONSOLIDATED)
BHCK3401,AVERAGE BALANCE - TRADING ASSETS (BHC CONSOLIDATED)
BHCK3404,QTLY AVG OF INT-BRG DEPS IN FGN OFFC (BHC CONSOLIDATED)
BHCK3408,VARIABLE RATE PREFERRED STOCK (BHC CONSOLIDATED)
BHCK3409,"LONG-TERM DEBT REPORTED IN SCHDULE HC, ITEM 19A ON THE BALANCE SHEET THAT IS SCHEDULED TO MATURE WITHIN ONE YEAR (BHC CONSOLIDATED)"
BHCK3411,COMMERCIAL LETTERS OF CREDIT (BHC CONSOLIDATED)
BHCK3430,ALL OTHER OFF BALANCE SHEET LIABILITIES (BHC CONSOLIDATED)
BHCK3432,SECURITIES BORROWED (BHC CONSOLIDATED)
BHCK3433,SECURITIES LENT (BHC CONSOLIDATED)
BHCK3434,GROSS COMMITMENTS TO PURCHASE WHEN-ISSUED SECURITIES (BHC CONSOLIDATED)
BHCK3435,GROSS COMMITMENTS TO SELL WHEN-ISSUED SECURITIES (BHC CONSOLIDATED)
BHCK3450,"NOTIONAL VALUE: SWAPS, INTEREST RATE CONTRACTS (BHC CONSOLIDATED)"
BHCK3459,TOT # OF BK HLDG CO SHRS ISSUED&OUTS (BHC CONSOLIDATED)
BHCK3493,LNS SECD BY FARMLAND-PAST DUE 30-89 (BHC CONSOLIDATED)
BHCK3494,LNS SECD BY FARMLAND-PAST DUE 90DYS (BHC CONSOLIDATED)
BHCK3495,LNS SECD BY FARMLAND-NONACCRUAL (BHC CONSOLIDATED)
BHCK3499,LNS SECD BY MULTIFAMILY-PST DU 30-89 (BHC CONSOLIDATED)
BHCK3500,LNS SECD BY MULTIFAMILY-PST DU 90DYS (BHC CONSOLIDATED)
BHCK3501,LNS SECD BY MULTIFAMILY-NONACCRUAL (BHC CONSOLIDATED)
BHCK3505,"OTHER ASSETS, PAST DUE 30-89 DAYS, ACCRUING (BHC CONSOLIDATED)"
BHCK3506,"OTHER ASSETS, PAST DUE 90+ DAYS, ACCRUING (BHC CONSOLIDATED)"
BHCK3507,"OTHER ASSETS, NONACCRUAL (BHC CONSOLIDATED)"
BHCK3508,"LNS&LEASES-PAST DUE 30-89 DYS, ACCRG (BHC CONSOLIDATED)"
BHCK3516,QUARTERLY AVERAGES OF LOANS AND LEASES
BHCK3517,AVERAGE BALS OF INT-BEARING DEPOSITS (BHC CONSOLIDATED)
BHCK3519,AVERAGE BALS OF EQUITY CAPITAL (BHC CONSOLIDATED)
BHCK3521,REALIZED GAINS (LOSSES) ON HELD-TO-MATURITY SECURITIES (BHC CONSOLIDATED)
BHCK3529,DERIVATIVE CONTRACTS: FAIR VALUE AMOUNTS CARRIED AS ASSETS (PAST DUE 30 THROUGH 89 DAYS AND STILL ACCRUING) (BHC CONSOLIDATED)
BHCK3530,DERIVATIVE CONTRACTS: FAIR VALUE AMOUNTS CARRIED AS ASSETS (PAST DUE 90 DAYS OR MORE AND STILL ACCRUING) (BHC CONSOLIDATED)
BHCK3545,TRADING ASSETS (BHC CONSOLIDATED)
BHCK3547,DERIVATIVES WITH A NEGATIVE FAIR VALUE (CONSOLIDATED) (BHC CONSOLIDATED)
BHCK3548,TRADING LIABILITIES (BHC CONSOLIDATED)
BHCK3577,"SALE OF PERPETUAL PREFERRED STOCK, GROSS (BHC CONSOLIDATED)"
BHCK3578,CONVERSION OR RETIREMENT OF PERPETUAL PREFERRED STOCK (BHC CONSOLIDATED)
BHCK3579,"SALE OF COMMON STOCK, GROSS (BHC CONSOLIDATED)"
BHCK3580,CONVERSION OR RETIREMENT OF COMMON STOCK (BHC CONSOLIDATED)
BHCK3581,OTHER ADJUSTMENTS TO EQUITY CAPITAL (BHC CONSOLIDATED)
BHCK3584,CHG-OFFS ON LNS SECURED BY FARMLAND (BHC CONSOLIDATED)
BHCK3585,RECVRS ON LNS SECURED BY FARMLAND (BHC CONSOLIDATED)
BHCK3588,CHG-OFFS ON LNS SECD BY MULTI-FAMILY (BHC CONSOLIDATED)
BHCK3589,RECVRS ON LNS SECD BY MULTI-FMLY RES (BHC CONSOLIDATED)
BHCK3656,DIRECT AND INDIRECT INVESTMENTS IN REAL ESTATE VENTURES (BHC CONSOLIDATED)
BHCK3814,"UNUSED COMMITMENTS-REVOLVING, ETC. (BHC CONSOLIDATED)"
BHCK3816,COMMTMTS TO FUND LNS SECD BY RE (BHC CONSOLIDATED)
BHCK3817,UNUSED COMMITMENTS-SECS UNDERWRITING (BHC CONSOLIDATED)
BHCK3820,AMOUNT OF FINANCIAL STANDBY LETTERS OF CREDIT CONVEYED TO OTHERS (BHC CONSOLIDATED)
BHCK3822,AMOUNT OF PERFORMANCE STANDBY LETTERS OF CREDIT CONVEYED TO OTHERS (BHC CONSOLIDATED)
BHCK3826,"NOTIONAL VALUE: SWAPS, FOREIGN EXCHANGE CONTRACTS (BHC CONSOLIDATED)"
BHCK4020,INTEREST INCOME ON FEDERAL FUNDS SOLD AND SECURITIES PURCHASED UNDER AGREEMENTS TO RESELL (BHC CONSOLIDATED)
BHCK4042,OTHER NONINTEREST INCOME: RENT AND OTHER INCOME FROM REAL ESTATE OWNED (BHC CONSOLIDATED)
BHCK4059,"INT&FEE ON LNS IN FGN OFF,EDGE&AGREE AND IBFS (BHC CONSOLIDATED)"
BHCK4060,INTEREST & DIVIDEND INCOME ON ALL OTHER SECURITIES (BHC CONSOLIDATED)
BHCK4062,SUBORDINATED NOTES AND DEBENTURES (BHC CONSOLIDATED)
BHCK4065,INCOME FROM LEASE FINANCING RECEIVABLES (BHC CONSOLIDATED)
BHCK4069,INTEREST INCOME FROM TRADING ASSETS (BHC CONSOLIDATED)
BHCK4070,INCOME FROM FIDUCIARY ACTIVITIES (BHC CONSOLIDATED)
BHCK4073,TOTAL INTEREST EXPENSE (BHC CONSOLIDATED)
BHCK4074,NET INTEREST INCOME (BHC CONSOLIDATED)
BHCK4079,TOTAL NONINTEREST INCOME (BHC CONSOLIDATED)
BHCK4092,OTHER NONINTEREST EXPENSE (BHC CONSOLIDATED)
BHCK4093,TOTAL NONINTEREST EXPENSE (BHC CONSOLIDATED)
BHCK4107,TOTAL INTEREST INCOME (BHC CONSOLIDATED)
BHCK4115,INTEREST INCOME ON BALANCES DUE FROM DEPOSITORY INSTITUTIONS (BHC CONSOLIDATED)
BHCK4135,SALARIES AND EMPLOYEE BENEFITS (BHC CONSOLIDATED)
BHCK4136,OTHER NONINTEREST EXPENSE: DIRECTORS FEES (BHC CONSOLIDATED)
BHCK4141,OTHER NONINTEREST EXPENSE: LEGAL FEES AND EXPENSES (BHC CONSOLIDATED)
BHCK4146,FEDERAL INSURANCE PREMIUM
BHCK4150,# OF FULL-TIME EQUIVALENT EMPLOYEES (BHC CONSOLIDATED)
BHCK4172,"INTEREST ON DEPOSITS IN FOREIGN OFFICES, EDGE AND AGREEMENT SUBS, AND IBFS (BHC CONSOLIDATED)"
BHCK4180,EXPENSE OF FEDERAL FUNDS PURCHASED AND SECURITIES SOLD UNDER AGREEMENTS TO REPURCHASE (BHC CONSOLIDATED)
BHCK4185,INTEREST ON TRADING LIABILITIES AND OTHER BORROWED MONEY (EXCLUDE SUBORDINATED NOTES AND DEBENTURES) (BHC CONSOLIDATED)
BHCK4217,"EXPENSE OF BANK PREMISES, FURNITURE, ETC. (BHC CONSOLIDATED)"
BHCK4230,PROVISIONS FOR CREDIT LOSSES FOR LOANS AND LEASES HELD FOR INVESTMENT
BHCK4300,Income (loss) before discontinued operations (item 8.c minus item 9)
BHCK4301,Income (loss) before applicable income taxes and discontinued operations (sum of items 8.a and 8.b)
BHCK4302,APPLICABLE INCOME TAXES (BHC CONSOLIDATED)
BHCK4313,INCOME ON TAX-EXEMPT LOANS AND LEASES TO STATES AND POLITICAL SUBDIVISIONS IN THE US (BHC CONSOLIDATED)
BHCK4340,NET INCOME (LOSS) ATTRIBUTABLE TO BANK HOLDING COMPANY (BHC CONSOLIDATED)
BHCK4356,"CHANGES IN EQUITY CAPITAL INCIDENT TO BUSINESS COMBINATIONS, NET (BHC CONSOLIDATED)"
BHCK4397,"INTEREST EXPENSE ON SUBORDINATED NOTES AND DEBENTURES, AND ON MANDATORY CONVERTIBLE SECURITIES (BHC CONSOLIDATED)"
BHCK4398,OTHER INTEREST EXPENSE (BHC CONSOLIDATED)
BHCK4435,INTEREST AND FEE INCOME ON LOANS: IN DOMESTIC OFFICES: LOANS SECURED BY 1-4 FAMILY RESIDENTIAL PROPERTIES (BHC CONSOLIDATED)
BHCK4436,INTEREST AND FEE INCOME ON LOANS: IN DOMESTIC OFFICES: ALL OTHER LOANS SECURED BY REAL ESTATE (BHC CONSOLIDATED)
BHCK4460,CASH DIVIDENDS DECLARED ON COMMON STOCK (BHC CONSOLIDATED)
BHCK4483,"SERVICE CHGS, COMMISSIONS & FEES (BHC CONSOLIDATED)"
BHCK4507,TAX-EXEMPT SECS ISSUED BY ST&POL SUB (BHC CONSOLIDATED)
BHCK4518,OTHER INTEREST INCOME (BHC CONSOLIDATED)
BHCK4519,NET INTEREST INCOME ON FULLY TAXABLE BASIS (BHC CONSOLIDATED)
BHCK4591,CHANGES TO OFFSETTING DEBT TO LIABILITY FOR ESOP DEBT GUARANTEED BY BHC (BHC CONSOLIDATED)
BHCK4592,"Net income before applicable income taxes, and discontinued operations (item 8.c. above) on a fully taxable equivalent basis"
BHCK4598,CASH DIVIDENDS DECLARED ON PREFERRED STOCK (BHC CONSOLIDATED)
BHCK4605,ALLOWANCE FOR LOAN AND LEASE LOSSES: RECOVERIES (BHC CONSOLIDATED)
BHCK4617,RECOV ON C & I LNS-U.S. ADDRESSES (BHC CONSOLIDATED)
BHCK4618,RECOV ON C & I LNS-NON-U.S. ADDRES (BHC CONSOLIDATED)
BHCK4627,RECOV ON LNS TO FGN GOVTS & INST (BHC CONSOLIDATED)
BHCK4628,RECOV ON ALL OTHER LOANS (BHC CONSOLIDATED)
BHCK4635,ALLOWANCE FOR LOAN AND LEASE LOSSES: CHARGE-OFFS (BHC CONSOLIDATED)
BHCK4643,CHG-OFFS ON LNS TO FGN GOVTS & INST (BHC CONSOLIDATED)
BHCK4644,CHG-OFFS ON ALL OTHER LOANS (BHC CONSOLIDATED)
BHCK4645,CHG-OFFS ON C&I LNS-U.S. ADDRESSES (BHC CONSOLIDATED)
BHCK4646,CHG-OFFS ON C&I LNS-NON-U.S. ADDRES (BHC CONSOLIDATED)
BHCK4652,"LOANS SECURED BY REAL ESTATE, NON-U.S. ADDRESSES: CHARGE-OFFS (BHC CONSOLIDATED)"
BHCK4655,CHARGE-OFFS ON LOANS TO FARMERS (BHC CONSOLIDATED)
BHCK4662,"LOANS SECURED BY REAL ESTATE, NON-U.S. ADDRESSES: RECOVERIES (BHC CONSOLIDATED)"
BHCK4665,RECOVERIES ON LOANS TO FARMERS (BHC CONSOLIDATED)
BHCK4782,SALES OF TREASURY STOCK (BHC CONSOLIDATED)
BHCK4783,PURCHASES OF TREASURY STOCK (BHC CONSOLIDATED)
BHCK4832,BALANCES DUE FROM RELATED INSTITUTIONS DUE FROM THE BHC (PARENT ONLY) GROSS (BHC CONSOLIDATED)
BHCK4833,BALANCES DUE FROM RELATED INSTITUTIONS DUE FROM SUB BANKS OF THE BHC GROSS (BHC CONSOLIDATED)
BHCK4834,BALANCES DUE FROM RELATED INSTITUTIONS DUE FROM NONBANK SUBS OF THE BHC GROSS (BHC CONSOLIDATED)
BHCK5041,BALANCES DUE TO RELATED INSTITUTIONS DUE TO THE BHC (PARENT ONLY) GROSS (BHC CONSOLIDATED)
BHCK5043,BALANCES DUE TO RELATED INSTITUTIONS DUE TO SUB BANKS OF THE BHC GROSS (BHC CONSOLIDATED)
BHCK5045,BALANCES DUE TO RELATED INSTITUTIONS DUE TO NONBANK SUBS OF THE BHC GROSS (BHC CONSOLIDATED)
BHCK5047,INTERCOMPANY LIABILITIES REPORTED ABOVE THAT QUALIFY AS LIABILITIES SUBORDINATED TO CLAIMS OF GENERAL CREDITORS (BHC CONSOLIDATED)
BHCK5351,NOTES TO FR Y-9C INCOME STATEMENT - 1ST LINE AMOUNT (BHC CONSOLIDATED)
BHCK5352,NOTES TO FR Y-9C INCOME STATEMENT - 2ND LINE AMOUNT (BHC CONSOLIDATED)
BHCK5353,NOTES TO FR Y-9C INCOME STATEMENT - 3RD LINE AMOUNT (BHC CONSOLIDATED)
BHCK5354,NOTES TO FR Y-9C INCOME STATEMENT - 4TH LINE AMOUNT (BHC CONSOLIDATED)
BHCK5355,NOTES TO FR Y-9C INCOME STATEMENT - 5TH LINE AMOUNT (BHC CONSOLIDATED)
BHCK5357,NOTES TO FR Y-9C BALANCE SHEET--LINE 2 AMOUNT (BHC CONSOLIDATED)
BHCK5358,NOTES TO FR Y-9C BALANCE SHEET--LINE 3 AMOUNT (BHC CONSOLIDATED)
BHCK5359,NOTES TO FR Y-9C BALANCE SHEET--LINE 4 AMOUNT (BHC CONSOLIDATED)
BHCK5360,NOTES TO FR Y-9C BALANCE SHEET--LINE 5 AMOUNT (BHC CONSOLIDATED)
BHCK5369,LOANS AND LEASES HELD FOR SALE (BHC CONSOLIDATED)
BHCK5377,"LNS TO US BKS,ETC.-PAST DU 30-89 DYS (BHC CONSOLIDATED)"
BHCK5378,"LNS TO US BKS,ETC.-PAST DU 90 DYS OR (BHC CONSOLIDATED)"
BHCK5379,"LNS TO US BKS,ETC.-NONACCRUAL (BHC CONSOLIDATED)"
BHCK5380,LNS TO FOREIGN BKS-PAST DU 30-89 DYS (BHC CONSOLIDATED)
BHCK5381,LNS TO FOREIGN BKS-PAST DU 90 DYS OR (BHC CONSOLIDATED)
BHCK5382,LNS TO FOREIGN BKS-NONACCRUAL (BHC CONSOLIDATED)
BHCK5389,"LNS TO FGN GOV,ETC.-PAS DU 30-89 DYS (BHC CONSOLIDATED)"
BHCK5390,"LNS TO FGN GOV,ETC.-PAS DU 90 DYS OR (BHC CONSOLIDATED)"
BHCK5391,"LNS TO FGN GOV,ETC.-NONACCRUAL (BHC CONSOLIDATED)"
BHCK5398,"RVLVG,OPEN-END LNS-PAST DU 30-89 DYS (BHC CONSOLIDATED)"
BHCK5399,"RVLVG,OPEN-END LNS-PAST DU 90 DYS OR (BHC CONSOLIDATED)"
BHCK5400,"RVLVG,OPEN-END LNS-NONACCRUAL (BHC CONSOLIDATED)"
BHCK5409,"CHG-OFFS OF LNS TO FINC COMMCL RE,CO (BHC CONSOLIDATED)"
BHCK5410,"RECOVERS OF LNS TO FINC COMMCL RE,CO (BHC CONSOLIDATED)"
BHCK5411,"CHG-OFFS OF RVLVG,OPEN-END LNS SECD (BHC CONSOLIDATED)"
BHCK5412,"RECOVERS OF RVLVG,OPEN-END LNS SECD (BHC CONSOLIDATED)"
BHCK5459,ALL OTHER LOANS-PAST DU 30-89 DAYS (BHC CONSOLIDATED)
BHCK5460,ALL OTHER LOANS-PAST DU 90 DYS OR MO (BHC CONSOLIDATED)
BHCK5461,ALL OTHER LOANS-NONACCRUAL (BHC CONSOLIDATED)
BHCK5523,WRITE-DOWNS ARISING FROM TRANSFERS OF LOANS TO THE HELD-FOR-SALE ACCOUNT (BHC CONSOLIDATED)
BHCK6416,"CHANGES IN INVESTMENTS AND ACTIVITIES REPORTED ON FR Y-6A? (1-YES, 0-NO) (BHC CONSOLIDATED)"
BHCK6438,FAIR MARKET VALUE OF MORTGAGE SERVICING ASSETS (BHC CONSOLIDATED)
BHCK6550,COMMITMENTS TO FUND LOANS NOT SECURED BY REAL ESTATE (BHC CONSOLIDATED)
BHCK6555,"DEBT MATURING IN ONE YEAR OR LESS (INCLUDED IN SCHEDULE HC, ITEMS 16 AND 19A) THAT IS ISSUED TO UNRELATED THIRD PARTIES BY BANK SUBSIDIARIES (BHC CONSOLIDATED)"
BHCK6556,"DEBT MATURING IN MORE THAN ONE YEAR (INCLUDED IN SCHEDULE HC, ITEMS 16 AND 19A) THAT IS ISSUED TO UNRELATED THIRD PARTIES BY BANK SUBSIDIARIES (BHC CONSOLIDATED)"
BHCK6557,OTH ASSETS ACQD IN SATFCTN OF DEBTS (BHC CONSOLIDATED)
BHCK6558,"COMMCL RE,ETC.-PAST DUE 30-89 DYS,AG (BHC CONSOLIDATED)"
BHCK6559,"COMMCL RE,ETC.-PAST DUE 90DYS OR MOR (BHC CONSOLIDATED)"
BHCK6560,"COMMCL RE,ETC.-NONACCRUAL (BHC CONSOLIDATED)"
BHCK6561,1ST AMOUNT - OTHER SIGNIFICANT OFF-BALANCE SHEET ITEMS > 25% OF TOTAL EQUITY CAPITAL (BHC CONSOLIDATED)
