BHCKB848,"ASSET-BACKED SECURITIES: AUTOMOBILE LOANS, A-F-S AMORTIZED COST (BHC CONSOLIDATED)"
BHCKB849,"ASSET-BACKED SECURITIES: AUTOMOBILE LOANS, A-F-S FAIR VALUE (BHC CONSOLIDATED)"
BHCKB850,"ASSET-BACKED SECURITIES: OTHER CONSUMER LOANS, H-T-M AMORTIZED COST (BHC CONSOLIDATED)"
BHCKB851,"ASSET-BACKED SECURITIES: OTHER CONSUMER LOANS, H-T-M FAIR VALUE (BHC CONSOLIDATED)"
BHCKB852,"ASSET-BACKED SECURITIES: OTHER CONSUMER LOANS, A-F-S AMORTIZED COST (BHC CONSOLIDATED)"
BHCKB853,"ASSET-BACKED SECURITIES: OTHER CONSUMER LOANS, A-F-S FAIR VALUE (BHC CONSOLIDATED)"
BHCKB854,"ASSET-BACKED SECURITIES: COMMERCIAL & INDUSTRIAL LOANS, H-T-M AMORTIZED COST (BHC CONSOLIDATED)"
BHCKB855,"ASSET-BACKED SECURITIES: COMMERCIAL & INDUSTRIAL LOANS, H-T-M FAIR VALUE (BHC CONSOLIDATED)"
BHCKB856,"ASSET-BACKED SECURITIES: COMMERCIAL & INDUSTRIAL LOANS, A-F-S AMORTIZED COST (BHC CONSOLIDATED)"
BHCKB857,"ASSET-BACKED SECURITIES: COMMERCIAL & INDUSTRIAL LOANS, A-F-S FAIR VALUE (BHC CONSOLIDATED)"
BHCKB858,"ASSET-BACKED SECURITIES: OTHER, H-T-M AMORTIZED COST (BHC CONSOLIDATED)"
BHCKB859,"ASSET-BACKED SECURITIES: OTHER, H-T-M FAIR VALUE (BHC CONSOLIDATED)"
BHCKB860,"ASSET-BACKED SECURITIES: OTHER, A-F-S AMORTIZED COST (BHC CONSOLIDATED)"
BHCKB861,"ASSET-BACKED SECURITIES: OTHER, A-F-S FAIR VALUE (BHC CONSOLIDATED)"
BHCKB983,"BENEFITS, LOSSES, AND EXPENSES FROM INSURANCE RELATED ACTIVITIES (BHC CONSOLIDATED)"
BHCKB984,"OTHER LIABILITIES, OTHER (BHC CONSOLIDATED)"
BHCKB985,AVERAGE BALANCE - OTHER EARNING ASSETS (BHC CONSOLIDATED)
BHCKB988,INSURANCE-RELATED ACTIVITIES: PROPERTY AND CASUALTY - REINSURANCE RECOVERABLES
BHCKB989,SECURITIES PURCHASED UNDER AGREEMENT TO RESELL (BHC CONSOLIDATED)
BHCKB990,"PROP & CASUALTY LIABILITIES - POLICY BENEFITS, RESERVES, AND LOSS ADJUSTED EXPENSES (BHC CONSOLIDATED)"
BHCKB991,PROP & CASUALTY LIABILITIES - UNEARNED PREMIUMS (BHC CONSOLIDATED)
BHCKB992,LIFE & HEALTH ASSETS - SEPARATE ACCOUNT ASSETS (BHC CONSOLIDATED)
BHCKB994,"LIFE & HEALTH LIABILITIES - POLICY BENEFITS, RESERVES, AND LOSS ADJUSTED EXPENSES (BHC CONSOLIDATED)"
BHCKB995,SECURITES SOLD UNDER AGREEMENTS TO REPURCHASE (BHC CONSOLIDATED)
BHCKB996,LIFE & HEALTH LIABILITIES - SEPARATE ACCOUNT LIABILITIES (BHC CONSOLIDATED)
BHCKC013,OTHER NONINTEREST INCOME: INCOME AND FEES FROM PRINTING OF CHECKS (BHC CONSOLIDATED)
BHCKC014,OTHER NONINTEREST INCOME: EARNINGS ON/INCREASE IN VALUE OF CASH SURRENDER VALUE OF LIFE INSURANCE (BHC CONSOLIDATED)
BHCKC015,OTHER NONINTEREST INCOME: SAFE DEPOSIT BOX RENT (BHC CONSOLIDATED)
BHCKC016,OTHER NONINTEREST INCOME: INCOME AND FEES FROM AUTOMATED TELLER MACHINES (ATMS) (BHC CONSOLIDATED)
BHCKC017,OTHER NONINTEREST EXPENSE: DATA PROCESSING EXPENSES (BHC CONSOLIDATED)
BHCKC018,"OTHER NONINTEREST EXPENSE: PRINTING, STATIONERY, AND SUPPLIES (BHC CONSOLIDATED)"
BHCKC026,ASSET-BACKED SECURITIES AND STRUCTURED FINANCIAL PRODUCTS: ASSET-BACKED SECURITIES (ABS) (HELD-TO-MATURITY: AMORTIZED COST) (BHC CONSOLIDATED)
BHCKC027,ASSET-BACKED SECURITIES AND STRUCTURED FINANCIAL PRODUCTS: ASSET-BACKED SECURITIES (ABS) (AVAILABLE-FOR-SALE: FAIR VALUE) (BHC CONSOLIDATED)
BHCKC079,TOTAL CHARGE-OFFS AND WRITE-DOWNS ARISING FROM TRANSFERS OF LOANS TO HELD-FOR-SALE ACCOUNT (BHC CONSOLIDATED)
BHCKC159,DO YOUR AGGREGATE NONFINANCIAL EQUITY INVESTMENTS EQUAL OR EXCEED THE LESSER OF $200 MILLION (ON AN ACQUISITION COST BASIS) OR 5 PERCENT OF THE BHC'S CONSOLIDATED TIER 1 CAPITAL AS OF THE REPORT DATE?
BHCKC161,"DOES THE BHC HOLD, DIRECT OR INDIRECT, ANY NONFINANCIAL EQUITY INVESTMENTS WITHIN A SMALL BUS INVEST CO (SIBC) OR UNDER SECTION 4(C)(6) OR 4(C)(7) OF BHC ACT, OR PURSUANT TO THE MERCHANT BANKING AUTHO"
BHCKC216,NONINTEREST EXPENSE: GOODWILL IMPAIRMENT LOSSES (BHC CONSOLIDATED)
BHCKC217,CLOSED-END LOANS SECURED BY 1-4 FAMILY RESIDENTIAL PROPERTIES: SECURED BY FIRST LIENS: RECOVERIES (BHC CONSOLIDATED)
BHCKC218,CLOSED-END LOANS SECURED BY 1-4 FAMILY RESIDENTIAL PROPERTIES: SECURED BY JUNIOR LIENS: RECOVERIES (BHC CONSOLIDATED)
BHCKC219,CREDIT DERIVATIVES: GROSS FAIR VALUES: GROSS POSITIVE FAIR VALUE (SOLD PROTECTION) (BHC CONSOLIDATED)
BHCKC220,CREDIT DERIVATIVES: GROSS FAIR VALUES: GROSS NEGATIVE FAIR VALUE (SOLD PROTECTION) (BHC CONSOLIDATED)
BHCKC221,CREDIT DERIVATIVES: GROSS FAIR VALUES: GROSS POSITIVE FAIR VALUE (PURCHASED PROTECTION) (BHC CONSOLIDATED)
BHCKC222,CREDIT DERIVATIVES: GROSS FAIR VALUES: GROSS NEGATIVE FAIR VALUE (PURCHASED PROTECTION) (BHC CONSOLIDATED)
BHCKC226,"LOANS AND LEASES HELD FOR SALE (INCLUDED IN SCHEDULE HC-N, ITEMS 1 THROUGH 8 ABOVE): NONACCRUAL (BHC CONSOLIDATED)"
BHCKC229,"CLOSED-END LOANS SECURED BY 1-4 FAMILY RESIDENTIAL PROPERTIES: SECURED BY FIRST LIENS, NONACCRUAL (BHC CONSOLIDATED)"
BHCKC230,"CLOSED-END LOANS SECURED BY 1-4 FAMILY RESIDENTIAL PROPERTIES: SECURED BY JUNIOR LIENS, NONACCRUAL (BHC CONSOLIDATED)"
BHCKC232,NONINTEREST EXPENSE: AMORTIZATION EXPENSE AND IMPAIRMENT LOSSES FOR OTHER INTANGIBLE ASSETS (BHC CONSOLIDATED)
BHCKC233,CHANGES IN ALLOWANCE FOR LOAN AND LEASE LOSSES: ADJUSTMENTS (BHC CONSOLIDATED)
BHCKC234,CLOSED-END LOANS SECURED BY 1-4 FAMILY RESIDENTIAL PROPERTIES: SECURED BY FIRST LIENS: CHARGE-OFFS (BHC CONSOLIDATED)
BHCKC235,CLOSED-END LOANS SECURED BY 1-4 FAMILY RESIDENTIAL PROPERTIES: SECURED BY JUNIOR LIENS: CHARGE-OFFS (BHC CONSOLIDATED)
BHCKC236,"CLOSED-END LOANS SECURED BY 1-4 FAMILY RESIDENTIAL PROPERTIES: SECURED BY FIRST LIENS, PAST DUE 30 - 89 DAYS STILL ACCRUING (BHC CONSOLIDATED)"
BHCKC237,"CLOSED-END LOANS SECURED BY 1-4 FAMILY RESIDENTIAL PROPERTIES: SECURED BY FIRST LIENS, PAST DUE 90 + DAYS STILL ACCRUING (BHC CONSOLIDATED)"
BHCKC238,"CLOSED-END LOANS SECURED BY 1-4 FAMILY RESIDENTIAL PROPERTIES: SECURED BY JUNIOR LIENS, PAST DUE 30 - 89 DAYS STILL ACCRUING (BHC CONSOLIDATED)"
BHCKC239,"CLOSED-END LOANS SECURED BY 1-4 FAMILY RESIDENTIAL PROPERTIES: SECURED BY JUNIOR LIENS, PAST DUE 90 + DAYS STILL ACCRUING (BHC CONSOLIDATED)"
BHCKC240,"LOANS AND LEASES HELD-FOR-SALE (INCLUDED IN SCHEDULE HC-N, ITEMS 1 THROUGH 8 ABOVE): PAST DUE 30 - 89 DAYS STILL ACCRUING (BHC CONSOLIDATED)"
BHCKC241,"LOANS AND LEASES HELD FOR SALE (INCLUDED IN SCHEDULE HC-N, ITEMS 1 THROUGH 8 ABOVE): PAST DUE 90 + DAYS AND STILL ACCRUING (BHC CONSOLIDATED)"
BHCKC242,PREMIUMS ON INSURANCE RELATED TO THE EXTENSION OF CREDIT (BHC CONSOLIDATED)
BHCKC243,ALL OTHER INSURANCE PREMIUMS (BHC CONSOLIDATED)
BHCKC244,PROP & CASUALTY ASSETS - TOTAL (BHC CONSOLIDATED)
BHCKC245,PROP & CASUALTY TOTAL EQUITY (BHC CONSOLIDATED)
BHCKC246,PROP & CASUALTY NET INCOME (BHC CONSOLIDATED)
BHCKC247,REINSURANCE RECOVERABLES
BHCKC248,LIFE & HEALTH UNDERWRITING ASSETS - TOTAL (BHC CONSOLIDATED)
BHCKC249,LIFE & HEALTH UNDERWRITING TOTAL EQUITY (BHC CONSOLIDATED)
BHCKC250,LIFE & HEALTH UNDERWRITING NET INCOME (BHC CONSOLIDATED)
BHCKC251,"HAS BHC ENTERED INTO BUSINESS COMBINATION DURING CALENDAR YEAR THAT WAS ACCOUNTED FOR BY PURCHASE METHOD OF ACCOUNTING ? 1=YES, 0=NO (BHC CONSOLIDATED)"
BHCKC252,NET ASSETS FOR BROKER-DEALER SUBS ENGAGED IN UNDERWRITING OR DEALING SECURITIES PURSUANT TO BHC ACT SECTION 4(K)(4)(E) AS AMENDED BY GRAMM-LEACH-BLILEY ACT (BHC CONSOLIDATED)
BHCKC253,NET ASSETS OF INSURANCE UNDERWRITING SUBSIDIARIES (BHC CONSOLIDATED)
BHCKC386,UNDERWRITING INCOME FROM INSURANCE AND REINSURANCE ACTIVITIES (BHC CONSOLIDATED)
BHCKC387,INCOME FROM OTHER INSURANCE ACTIVITIES (BHC CONSOLIDATED)
BHCKC388,UNCOLLECTABLE CREDIT CARD FEES REVERSED AGAINST INCOME (BHC CONSOLIDATED)
BHCKC389,SEPARATE VALUATION ALLOW FOR UNCOLLECTABLE CREDIT CARD FEES (BHC CONSOLIDATED)
BHCKC390,AMT OF ALLOWANCE FOR LOAN AND LEASE LOSSES TO CC FEES (BHC CONSOLIDATED)
BHCKC391,OUTSTANDING CREDIT CARD FEES AND FINANCE CHARGES (BHC CONSOLIDATED)
BHCKC407,MEMORANDA HC-S OUTSTANDING CREDIT CARD FEES AND FINANCE CHARGES (BHC CONSOLIDATED)
BHCKC409,STOCK-BASED EMP COMPENSATION EXP (NET)- FAIR VALUE (BHC CONSOLIDATED)
BHCKC410,ADDITIONS TO NONACCRUAL ASSETS
BHCKC411,NONACCRUAL ASSETS SOLD DURING THE QUARTER
BHCKC435,ALLOCATED TRANSFER RISK RESERVE INCLUDED IN HI-B(II)7 (BHC CONSOLIDATED)
BHCKC447,"Is confidential treatment requested for any portion of this report submission? (0=No, 1=Yes)"
BHCKC699,SUBORDINATED NOTES PAYABLE TO TRUST ISSUING TRUST PREFERRED SECURITIES (BHC CONSOLIDATED)
BHCKC700,"HAS THE BHC SOLD OR OTHERWISE LIQUIDATED ITS HOLDING OF ANY NONFINANCIAL EQUITY INVESTMENT SINCE THE PREVIOUS REPORTING PERIOD? (1=YES,0=NO) (BHC CONSOLIDATED)"
BHCKC701,"DOES THE BHC MANAGE ANY NONFINANCIAL EQUITY INVESTMENTS FOR THE BENEFIT OF OTHERS? (1=YES,0=NO) (BHC CONSOLIDATED)"
BHCKC779,PURCHASED IMPAIRED LOANS HELD FOR INVESTMENT ACCOUNTED FOR IN ACCORDANCE WITH AICPA STATEMENT OF POSITION 03-3 (EXCLUDE LOANS HELD FOR SALE): OUTSTANDING BALANCE
BHCKC780,"PURCHASED IMPAIRED LOANS HELD FOR INVESTMENT ACCOUNTED FOR IN ACCORDANCE WITH AICPA STATEMENT OF POSITION 03-3 (EXCLUDE LOANS HELD FOR SALE): CARRYING AMOUNT INCLUDED IN SCHEDULE RC-C, PART I, ITEMS 1 THRU 9"
BHCKC781,AMOUNT OF ALLOWANCE FOR POST-ACQUISITION LOSSES ON PURCHASED IMPAIRED LOANS ACCOUNTED FOR IN ACCORDANCE WITH AICPA STATEMENT OF POSITION 03-3
BHCKC880,CHARGE-OFFS OF ALL OTHER LEASE FINANCING RECEIVABLES
BHCKC884,"HAS THE BANK HOLDING COMPANY ENGAGED IN A FULL-SCOPE INDEPENDENT EXTERNAL AUDIT AS OF THE DECEMBER 31 REPORT DATE? ""1"" FOR YES, ""0"" FOR NO"
BHCKC886,FEES AND COMMISSIONS FROM SECURITIES BROKERAGE (BHC CONSOLIDATED)
BHCKC887,FEES AND COMMISSIONS FROM ANNUITY SALES (BHC CONSOLIDATED)
BHCKC888,"INVESTMENT BANKING, ADVISORY, AND UNDERWRITING FEES AND COMMISSIONS (BHC CONSOLIDATED)"
BHCKC889,NET GAINS (LOSSES) ON CREDIT DERIVATIVES HELD FOR TRADING (BHC CONSOLIDATED)
BHCKC890,NET GAINS (LOSSES) ON CREDIT DERIVATIVES HELD FOR PURPOSES OTHER THAN TRADING (BHC CONSOLIDATED)
BHCKC891,CHARGE-OFFS: 1-4 FAMILY RESIDENTIAL CONSTRUCTION LOANS (BHC CONSOLIDATED)
BHCKC892,RECOVERIES: 1-4 FAMILY RESIDENTIAL CONSTRUCTION LOANS (BHC CONSOLIDATED)
BHCKC893,CHARGE-OFFS: OTHER CONSTRUCTION LOANS AND ALL LAND DEVELOPMENT AND OTHER LAND LOANS (BHC CONSOLIDATED)
BHCKC894,RECOVERIES: OTHER CONSTRUCTION LOANS AND ALL LAND DEVELOPMENT AND OTHER LAND LOANS (BHC CONSOLIDATED)
BHCKC895,CHARGE-OFFS: LOANS SECURED BY OWNER-OCCUPIED NONFARM NONRESIDENTIAL PROPERTIES (BHC CONSOLIDATED)
BHCKC896,RECOVERIES: LOANS SECURED BY OWNER-OCCUPIED NONFARM NONRESIDENTIAL PROPERTIES (BHC CONSOLIDATED)
BHCKC897,CHARGE-OFFS: LOANS SECURED BY OTHER NONFARM NONRESIDENTIAL PROPERTIES (BHC CONSOLIDATED)
BHCKC898,RECOVERIES: LOANS SECURED BY OTHER NONFARM NONRESIDENTIAL PROPERTIES (BHC CONSOLIDATED)
BHCKC968,CREDIT DERIVATIVES: NOTIONAL AMOUNTS: CREDIT DEFAULT SWAPS (SOLD PROTECTION) (BHC CONSOLIDATED)
BHCKC969,CREDIT DERIVATIVES: NOTIONAL AMOUNTS: CREDIT DEFAULT SWAPS (PURCHASED PROTECTION) (BHC CONSOLIDATED)
BHCKC970,CREDIT DERIVATIVES: NOTIONAL AMOUNTS: TOTAL RETURN SWAPS (SOLD PROTECTION) (BHC CONSOLIDATED)
BHCKC971,CREDIT DERIVATIVES: NOTIONAL AMOUNTS: TOTAL RETURN SWAPS (PURCHASED PROTECTION) (BHC CONSOLIDATED)
BHCKC972,CREDIT DERIVATIVES: NOTIONAL AMOUNTS: CREDIT OPTIONS (SOLD PROTECTION) (BHC CONSOLIDATED)
BHCKC973,CREDIT DERIVATIVES: NOTIONAL AMOUNTS: CREDIT OPTIONS (PURCHASED PROTECTION) (BHC CONSOLIDATED)
BHCKC974,CREDIT DERIVATIVES: NOTIONAL AMOUNTS: OTHER CREDIT DERIVATIVES (SOLD PROTECTION) (BHC CONSOLIDATED)
BHCKC975,CREDIT DERIVATIVES: NOTIONAL AMOUNTS: OTHER CREDIT DERIVATIVES (PURCHASED PROTECTION) (BHC CONSOLIDATED)
BHCKC988,ASSET-BACKED SECURITIES AND STRUCTURED FINANCIAL PRODUCTS: ASSET-BACKED SECURITIES (ABS) (HELD-TO-MATURITY: FAIR VALUE) (BHC CONSOLIDATED)
BHCKC989,ASSET-BACKED SECURITIES AND STRUCTURED FINANCIAL PRODUCTS: ASSET-BACKED SECURITIES (ABS) (AVAILABLE-FOR-SALE: AMORTIZED COST) (BHC CONSOLIDATED)
BHCKD957,CASH AND BALANCES DUE FROM DEPOSITORY INSTITUTIONS (TOTALS FROM SCHEDULE HC) (BHC CONSOLIDATED)
BHCKD958,CASH AND BALANCES DUE FROM DEPOSITORY INSTITUTIONS ( ALLOCATION BY RISK WEIGHT CATEGORY 0%) (BHC CONSOLIDATED)
BHCKD959,CASH AND BALANCES DUE FROM DEPOSITORY INSTITUTIONS( ALLOCATION BY RISK WEIGHT CATEGORY 20%) (BHC CONSOLIDATED)
BHCKD960,CASH AND BALANCES DUE FROM DEPOSITORY INSTITUTIONS (ALLOCATION BY RISK WEIGHT CATEGORY 100%) (BHC CONSOLIDATED)
BHCKD961,SECURITIES: HELD-TO-MATURITY SECURITIES (TOTALS FROM SCHEDULE HC) (BHC CONSOLIDATED)
BHCKD962,SECURITIES: HELD-TO-MATURITY SECURITIES (ALLOCATION BY RISK WEIGHT CATEGORY 0%) (BHC CONSOLIDATED)
BHCKD963,SECURITIES: HELD-TO-MATURITY SECURITIES (ALLOCATION BY RISK WEIGHT CATEGORY 20%) (BHC CONSOLIDATED)
BHCKD964,SECURITIES: HELD-TO-MATURITY SECURITIES (ALLOCATION BY RISK WEIGHT CATEGORY 50%) (BHC CONSOLIDATED)
BHCKD965,SECURITIES: HELD-TO-MATURITY SECURITIES (ALLOCATION BY RISK WEIGHT CATEGORY 100%) (BHC CONSOLIDATED)
BHCKD967,SECURITIES: AVAILABLE-FOR-SALE DEBT SECURITIES AND EQUITY SECURITIES WITH READILY DETERMINABLE FAIR VALUES NOT HFT (ALLOCATION BY RISK WEIGHT CATEGORY 0%) (BHC CONSOLIDATED)
BHCKD968,SECURITIES: AVAILABLE-FOR-SALE DEBT SECURITIES AND EQUITY SECURITIES WITH READILY DETERMINABLE FAIR VALUES NOT HFT (ALLOCATION BY RISK WEIGHT CATEGORY 20%) (BHC CONSOLIDATED)
BHCKD969,SECURITIES: AVAILABLE-FOR-SALE DEBT SECURITIES AND EQUITY SECURITIES WITH READILY DETERMINABLE FAIR VALUES NOT HFT (ALLOCATION BY RISK WEIGHT CATEGORY 50%) (BHC CONSOLIDATED)
BHCKD970,SECURITIES: AVAILABLE-FOR-SALE DEBT SECURITIES AND EQUITY SECURITIES WITH READILY DETERMINABLE FAIR VALUES NOT HFT (ALLOCATION BY RISK WEIGHT CATEGORY 100%) (BHC CONSOLIDATED)
BHCKD971,FEDERAL FUNDS SOLD (IN DOMESTIC OFFICES) TOTALS FROM SCHEDULE HC) (BHC CONSOLIDATED)
BHCKD972,FEDERAL FUNDS SOLD (IN DOMESTIC OFFICES) (ALLOCATION BY RISK WEIGHT CATEGORY 0%) (BHC CONSOLIDATED)
BHCKD973,FEDERAL FUNDS SOLD (IN DOMESTIC OFFICES) (ALLOCATION BY RISK WEIGHT CATEGORY 20%) (BHC CONSOLIDATED)
BHCKD974,FEDERAL FUNDS SOLD (IN DOMESTIC OFFICES) (ALLOCATION BY RISK WEIGHT CATEGORY 100%) (BHC CONSOLIDATED)
BHCKD976,TRADING ASSETS: TOTALS FROM SCHEDULE HC (BHC CONSOLIDATED)
BHCKD977,TRADING ASSETS: ALLOCATION BY RISK WEIGHT CATEGORY 0% (BHC CONSOLIDATED)
BHCKD978,TRADING ASSETS: ALLOCATION BY RISK WEIGHT CATEGORY 20% (BHC CONSOLIDATED)
BHCKD979,TRADING ASSETS: ALLOCATION BY RISK WEIGHT CATEGORY 50% (BHC CONSOLIDATED)
BHCKD980,TRADING ASSETS: ALLOCATION BY RISK WEIGHT CATEGORY 100% (BHC CONSOLIDATED)
BHCKD981,ALL OTHER ASSETS (TOTALS FROM SCHEDULE HC) (BHC CONSOLIDATED)
BHCKD982,ALL OTHER ASSETS (ALLOCATION BY RISK WEIGHT CATEGORY 0%) (BHC CONSOLIDATED)
BHCKD983,ALL OTHER ASSETS (ALLOCATION BY RISK WEIGHT CATEGORY 20%) (BHC CONSOLIDATED)
BHCKD984,ALL OTHER ASSETS (ALLOCATION BY RISK WEIGHT CATEGORY 50%) (BHC CONSOLIDATED)
BHCKD985,ALL OTHER ASSETS (ALLOCATION BY RISK WEIGHT CATEGORY 100%) (BHC CONSOLIDATED)
BHCKD987,TOTAL BALANCE SHEET ASSETS (ALLOCATION BY RISK WEIGHT CATEGORY 0%) (BHC CONSOLIDATED)
BHCKD988,TOTAL BALANCE SHEET ASSETS ( ALLOCATION BY RISK WEIGHT CATEGORY 20%) (BHC CONSOLIDATED)
BHCKD989,TOTAL BALANCE SHEET ASSETS (ALLOCATION BY RISK WEIGHT CATEGORY 50%) (BHC CONSOLIDATED)
BHCKD990,TOTAL BALANCE SHEET ASSETS (ALLOCATION BY RISK WEIGHT CATEGORY 100%) (BHC CONSOLIDATED)
BHCKD991,"FINANCIAL STANDBY LETTERS OF CREDIT (FACE, NOTIONAL, OR OTHER AMOUNT) (BHC CONSOLIDATED)"
BHCKD992,FINANCIAL STANDBY LETTERS OF CREDIT (CREDIT EQUIVALENT AMOUNT) (BHC CONSOLIDATED)
BHCKD993,FINANCIAL STANDBY LETTERS OF CREDIT (ALLOCATION BY RISK WEIGHT CATEGORY 0%) (BHC CONSOLIDATED)
BHCKD994,FINANCIAL STANDBY LETTERS OF CREDIT (ALLOCATION BY RISK WEIGHT CATEGORY 20%) (BHC CONSOLIDATED)
BHCKD995,FINANCIAL STANDBY LETTERS OF CREDIT (ALLOCATION BY RISK WEIGHT CATEGORY 50%) (BHC CONSOLIDATED)
BHCKD996,FINANCIAL STANDBY LETTERS OF CREDIT (ALLOCATION BY RISK WEIGHT CATEGORY 100%) (BHC CONSOLIDATED)
BHCKD997,"PERFORMANCE STANDBY LETTERS OF CREDIT AND TRANSACTION-RELATED CONTINGENT ITEMS (FACE, NOTIONAL, OR OTHER AMOUNT) (BHC CONSOLIDATED)"
BHCKD998,PERFORMANCE STANDBY LETTERS OF CREDIT AND TRANSACTION-RELATED CONTINGENT ITEMS (CREDIT EQUIVALENT AMOUNT) (BHC CONSOLIDATED)
BHCKD999,PERFORMANCE STANDBY LETTERS OF CREDIT AND TRANSACTION-RELATED CONTINGENT ITEMS (ALLOCATION BY RISK WEIGHT CATEGORY 0%) (BHC CONSOLIDATED)
BHCKF064,"SECURED LIABILITIES: AMOUNT OF ""FED FUNDS PURCHASED IN DOMESTIC OFFICES"" THAT ARE SECURED (INCLUDED IN SCHEDULE HC, ITEM 14.A) (BHC CONSOLIDATED)"
BHCKF065,"SECURED LIABILITIES: AMOUNT OF ""OTHER BORROWINGS"" THAT ARE SECURED (INCLUDED IN SCHEDULE HC, ITEM 14.D) (BHC CONSOLIDATED)"
BHCKF158,CONSOLIDATED: 1-4 FAMILY RESIDENTIAL CONSTRUCTION LOANS (BHC CONSOLIDATED)
BHCKF159,CONSOLIDATED: OTHER CONSTRUCTION LOANS AND ALL LAND DEVELOPMENT AND OTHER LAND LOANS (BHC CONSOLIDATED)
BHCKF160,CONSOLIDATED: LOANS SECURED BY OWNER-OCCUPIED NONFARM NONRESIDENTIAL PROPERTIES (BHC CONSOLIDATED)
BHCKF161,CONSOLIDATED: LOANS SECURED BY OTHER NONFARM NONRESIDENTIAL PROPERTIES (BHC CONSOLIDATED)
BHCKF162,"CONSOLIDATED: LEASES TO INDIVIDUALS FOR HOUSEHOLD, FAMILY, AND OTHER PERSONAL EXPENDITURES (I.E., CONSUMER LEASES) (BHC CONSOLIDATED)"
BHCKF163,CONSOLIDATED: ALL OTHER LEASES (BHC CONSOLIDATED)
BHCKF164,1-4 FAMILY RESIDENTIAL CONSTRUCTION LOAN COMMITMENTS (BHC CONSOLIDATED)
BHCKF165,"COMMERCIAL REAL ESTATE, OTHER CONSTRUCTION LOAN, AND LAND DEVELOPMENT LOAN COMMITMENTS (BHC CONSOLIDATED)"
BHCKF166,"PAST DUE 30 THROUGH 89 DAYS AND STILL ACCRUING: LEASES TO INDIVIDUALS FOR HOUSEHOLD, FAMILY, AND OTHER PERSONAL EXPENDITURES (BHC CONSOLIDATED)"
BHCKF167,"PAST DUE 90 DAYS OR MORE AND STILL ACCRUING: LEASES TO INDIVIDUALS FOR HOUSEHOLD, FAMILY, AND OTHER PERSONAL EXPENDITURES (BHC CONSOLIDATED)"
BHCKF168,"NONACCRUAL: LEASES TO INDIVIDUALS FOR HOUSEHOLD, FAMILY, AND OTHER PERSONAL EXPENDITURES (BHC CONSOLIDATED)"
BHCKF169,PAST DUE 30 THROUGH 89 DAYS AND STILL ACCRUING: ALL OTHER LEASES (BHC CONSOLIDATED)
BHCKF170,PAST DUE 90 DAYS OR MORE AND STILL ACCRUING: ALL OTHER LEASES (BHC CONSOLIDATED)
BHCKF171,NONACCRUAL: ALL OTHER LEASES (BHC CONSOLIDATED)
BHCKF172,PAST DUE 30 THROUGH 89 DAYS AND STILL ACCRUING: 1-4 FAMILY RESIDENTIAL CONSTRUCTION LOANS (BHC CONSOLIDATED)
BHCKF173,"PAST DUE 30 THROUGH 89 DAYS AND STILL ACCRUING: OTHER CONSTRUCTION, LOANS AND ALL LAND DEVELOPMENT AND OTHER LAND LOANS (BHC CONSOLIDATED)"
BHCKF174,PAST DUE 90 DAYS OR MORE AND STILL ACCRUING: 1-4 FAMILY RESIDENTIAL CONSTRUCTION LOANS (BHC CONSOLIDATED)
BHCKF175,"PAST DUE 90 DAYS OR MORE AND STILL ACCRUING: OTHER CONSTRUCTION, LOANS AND ALL LAND DEVELOPMENT AND OTHER LAND LOANS (BHC CONSOLIDATED)"
BHCKF176,NONACCRUAL: 1-4 FAMILY RESIDENTIAL CONSTRUCTION LOANS (BHC CONSOLIDATED)
BHCKF177,"NONACCRUAL: OTHER CONSTRUCTION, LOANS AND ALL LAND DEVELOPMENT AND OTHER LAND LOANS (BHC CONSOLIDATED)"
BHCKF178,PAST DUE 30 THROUGH 89 DAYS AND STILL ACCRUING: LOANS SECURED BY OWNEROCCUPIED NONFARM NONRESIDENTIAL PROPERTIES (BHC CONSOLIDATED)
BHCKF179,PAST DUE 30 THROUGH 89 DAYS AND STILL ACCRUING: LOANS SECURED BY OTHER NONFARM NONRESIDENTIAL PROPERTIES (BHC CONSOLIDATED)
BHCKF180,PAST DUE 90 DAYS OR MORE AND STILL ACCRUING: LOANS SECURED BY OWNEROCCUPIED NONFARM NONRESIDENTIAL PROPERTIES (BHC CONSOLIDATED)
BHCKF181,PAST DUE 90 DAYS OR MORE AND STILL ACCRUING: LOANS SECURED BY OTHER NONFARM NONRESIDENTIAL PROPERTIES (BHC CONSOLIDATED)
BHCKF182,NONACCRUAL: LOANS SECURED BY OWNEROCCUPIED NONFARM NONRESIDENTIAL PROPERTIES (BHC CONSOLIDATED)
BHCKF183,NONACCRUAL: LOANS SECURED BY OTHER NONFARM NONRESIDENTIAL PROPERTIES (BHC CONSOLIDATED)
BHCKF185,"CHARGE-OFFS: LEASES TO INDIVIDUALS FOR HOUSEHOLD, FAMILY, AND OTHER PERSONAL EXPENDITURES (BHC CONSOLIDATED)"
BHCKF186,TRADING REVENUE: CREDIT EXPOSURES (BHC CONSOLIDATED)
BHCKF187,"RECOVERIES: LEASES TO INDIVIDUALS FOR HOUSEHOLD, FAMILY, AND OTHER PERSONAL EXPENDITURES (BHC CONSOLIDATED)"
BHCKF188,RECOVERIES: ALL OTHER LEASES (BHC CONSOLIDATED)
BHCKF228,NONCASH INCOME FROM NEGATIVE AMORTIZATION ON CLOSED-END LOANS SECURED BY 1-4 FAMILY RESIDENTIAL PROPERTIES
BHCKF230,TOTAL CARRYING AMOUNT OF CLOSED-END LOANS WITH NEGATIVE AMORTIZATION FEATURES SECURE BY 1-4 FAMILY RESIDENTIAL PROPERTIES
BHCKF231,TOTAL MAXIMUM REMAINING AMOUNT OF NEGATIVE AMORTIZATION CONTRACTUALLY PERMITTED ON CLOSED-END LOANS SECURED BY 1-4 FAMILY RESIDENTIAL PROPERTIES.
BHCKF232,TOTAL AMOUNT OF NEGATIVE AMORTIZATION ON CLOSED-END LOANS SECURED BY 1-4 FAMILY RESIDENTIAL PROPERTIES INCLUDED IN THE CARRYING AMOUNT REPORTED IN MEMORANDUM ITEM 8.A ABOVE
BHCKF240,TOTAL FAIR VALUE REPORTED ON HC: NONTRADING SECURITIES AT FAIR VALUE WITH CHANGES IN FAIR VALUE REPORTED IN CURRENT EARNINGS (BHC CONSOLIDATED)
BHCKF241,LEVEL 2 FAIR VALUE MEASUREMENTS: NONTRADING SECURITIES AT FAIR VALUE WITH CHANGES IN FAIR VALUE REPORTED IN CURRENT EARNINGS (BHC CONSOLIDATED)
BHCKF242,LEVEL 3 FAIR VALUE MEASUREMENTS: NONTRADING SECURITIES AT FAIR VALUE WITH CHANGES IN FAIR VALUE REPORTED IN CURRENT EARNINGS (BHC CONSOLIDATED)
BHCKF252,TOTAL FAIR VALUE REPORTED ON HC: DEPOSITS (BHC CONSOLIDATED)
BHCKF253,LEVEL 2 FAIR VALUE MEASUREMENTS: DEPOSITS (BHC CONSOLIDATED)
BHCKF254,LEVEL 3 FAIR VALUE MEASUREMENTS: DEPOSITS (BHC CONSOLIDATED)
BHCKF261,TOTAL FAIR VALUE REPORTED ON HC: LOAN COMMITMENTS (NOT ACCOUNTED FOR AS DERIVATIVES) (BHC CONSOLIDATED)
BHCKF262,LEVEL 2 FAIR VALUE MEASUREMENTS: LOAN COMMITMENTS (NOT ACCOUNTED FOR AS DERIVATIVES) (BHC CONSOLIDATED)
BHCKF263,LEVEL 3 FAIR VALUE MEASUREMENTS: LOAN COMMITMENTS (NOT ACCOUNTED FOR AS DERIVATIVES) (BHC CONSOLIDATED)
BHCKF551,NET GAINS (LOSSES) RECOGNIZED IN EARNINGS ON ASSETS AND LIABILITIES THAT ARE REPORTED AT FAIR VALUE UNDER OPTION: NET GAINS (LOSSES) ON ASSETS (BHC CONSOLIDATED)
BHCKF552,NET GAINS (LOSSES) RECOGNIZED IN EARNINGS ON ASSETS AND LIABILITIES THAT ARE REPORTED AT FAIR VALUE UNDER OPTION: ESTIMATED NET GAINS (LOSSES) ON LOANS ATTRUBUTABLE TO CHANGES IN INSTRUMENT-SPECIFIC C
BHCKF553,NET GAINS (LOSSES) RECOGNIZED IN EARNINGS ON ASSETS AND LIABILITIES THAT ARE REPORTED AT FAIR VALUE UNDER OPTION: NET GAINS (LOSSES) ON LIABILITIES (BHC CONSOLIDATED)
BHCKF554,NET GAINS (LOSSES) RECOGNIZED IN EARNINGS ON ASSETS AND LIABILITIES THAT ARE REPORTED AT FAIR VALUE UNDER OPTION: ESTIMATED NET GAINS (LOSSES) ON LIABILITIES ATTRIBUTABLE TO CHANGES IN INSTRUMENT-SPEC
BHCKF555,OTHER NONINTEREST INCOME: BANK CARD AND CREDIT CARD INTERCHANGE FEES (BHC CONSOLIDATED)
BHCKF556,OTHER NONINTEREST EXPENSE: ACCOUNTING AND AUDITING EXPENSES (BHC CONSOLIDATED)
BHCKF557,OTHER NONINTEREST EXPENSE: CONSULTING AND ADVISORY EXPENSES (BHC CONSOLIDATED)
BHCKF558,OTHER NONINTEREST EXPENSE: AUTOMATED TELLER MACHINE (ATM) AND INTERCHANGE EXPENSES (BHC CONSOLIDATED)
BHCKF559,TELECOMMUNICATIONS EXPENSES (BHC CONSOLIDATED)
BHCKF585,LOANS MEASURED AT FAIR VALUE: COMMERCIAL AND INDUSTRIAL LOANS (CONSOLIDATED) (BHC CONSOLIDATED)
BHCKF589,"LOANS MEASURED AT FAIR VALUE: LOANS TO INDIVIDUALS FOR HOUSEHOLD, FAMILY, AND OTHER PERSONAL EXPENDITURES (I.E., CONSUMER LOANS) (INCLUDES PURCHASED PAPER): OTHER LOANS (CONSOLIDATED) (BHC CONSOLIDATE"
BHCKF597,UNPAID PRINCIPAL BALANCES OF LOANS MEASURED AT FAIR VALUE: COMMERCIAL AND INDUSTRIAL LOANS (CONSOLIDATED) (BHC CONSOLIDATED)
BHCKF601,"UNPAID PRINCIPAL BALANCES OF LOANS MEASURED AT FAIR VALUE: LOANS TO INDIVIDUALS FOR HOUSEHOLD, FAMILY, AND OTHER PERSONAL EXPENDITURES (I.E., CONSUMER LOANS) (INCLUDES PURCHASED PAPER): OTHER LOANS (C"
BHCKF614,LOANS: COMMERCIAL AND INDUSTRIAL LOANS (CONSOLIDATED) (BHC CONSOLIDATED)
BHCKF618,"LOANS: LOANS TO INDIVIDUALS FOR HOUSEHOLD, FAMILY, AND OTHER PERSONAL EXPENDITURES (I.E., CONSUMER LOANS) (INCLUDES PURCHASED PAPER): OTHER LOANS (CONSOLIDATED) (BHC CONSOLIDATED)"
BHCKF624,ALL OTHER TRADING LIABILITIES (CONSOLIDATED) (BHC CONSOLIDATED)
BHCKF632,UNPAID PRINCIPAL BALANCES OF LOANS MEASURED AT FAIR VALUE: COMMERCIAL AND INDUSTRIAL LOANS (CONSOLIDATED) (BHC CONSOLIDATED)
BHCKF636,"UNPAID PRINCIPAL BALANCES OF LOANS MEASURED AT FAIR VALUE: LOANS TO INDIVIDUALS FOR HOUSEHOLD, FAMILY, AND OTHER PERSONAL EXPENDITURES (I.E., CONSUMER LOANS) (INCLUDES PURCHASED PAPER): OTHER LOANS (C"
BHCKF639,LOANS MEASURED AT FAIR VALUE THAT ARE PAST DUE BY 90 DAYS OR MORE: FAIR VALUE
BHCKF640,LOANS MEASURED AT FAIR VALUE THAT ARE PAST DUE BY 90 DAYS OR MORE: UNPAID PRINCIPAL BALANCE
BHCKF643,TRADING ASSETS: ASSET-BACKED SECURITIES: CREDIT CARD RECEIVABLES
BHCKF644,TRADING ASSETS: ASSET-BACKED SECURITIES: HOME EQUITY LINES
BHCKF645,TRADING ASSETS: ASSET-BACKED SECURITIES: AUTOMOBILE LOANS
BHCKF646,TRADING ASSETS: ASSET-BACKED SECURITIES: OTHER CONSUMER LOANS
BHCKF647,TRADING ASSETS: ASSET-BACKED SECURITIES: COMMERCIAL AND INDUSTRIAL LOANS
BHCKF648,TRADING ASSETS: ASSET-BACKED SECURITIES: OTHER LOANS
BHCKF652,TRADING ASSETS: EQUITY SECURITIES: READILY DETERMINABLE FAIR VALUES
BHCKF653,TRADING ASSETS: EQUITY SECURITIES: OTHER
BHCKF654,TRADING ASSETS: LOANS PENDING SECURITIZATION
BHCKF655,"FIRST ITEMIZED AMOUNT FOR OTHER TRADING ASSETS (ITEMIZE AND DESCRIBE AMOUNTS INCLUDED IN SCHEDULE RC-D, ITEM 9, THAT IS GREATER THAN $25,000 AND EXCEEDS 25% OF THE ITEM)"
BHCKF656,"SECOND ITEMIZED AMOUNT FOR OTHER TRADING ASSETS (ITEMIZE AND DESCRIBE AMOUNTS INCLUDED IN SCHEDULE RC-D, ITEM 9, THAT IS GREATER THAN $25,000 AND EXCEEDS 25% OF THE ITEM)"
BHCKF657,"THIRD ITEMIZED AMOUNT FOR OTHER TRADING ASSETS (ITEMIZE AND DESCRIBE AMOUNTS INCLUDED IN SCHEDULE RC-D, ITEM 9, THAT IS GREATER THAN $25,000 AND EXCEEDS 25% OF THE ITEM)"
BHCKF658,"FIRST ITEMIZED AMOUNT OTHER TRADING LIABILITIES (ITEMIZE AND DESCRIBE AMOUNTS INCLUDED IN SCHEDULE RC-D, ITEM 13.B, THAT IS GREATER THAN $25,000 AND EXCEEDS 25% OF THE ITEM)"
BHCKF659,"SECOND ITEMIZED AMOUNT OTHER TRADING LIABILITIES (ITEMIZE AND DESCRIBE AMOUNTS INCLUDED IN SCHEDULE RC-D, ITEM 13.B, THAT IS GREATER THAN $25,000 AND EXCEEDS 25% OF THE ITEM)"
BHCKF660,"THIRD ITEMIZED AMOUNT OTHER TRADING LIABILITIES (ITEMIZE AND DESCRIBE AMOUNTS INCLUDED IN SCHEDULE RC-D, ITEM 13.B, THAT IS GREATER THAN $25,000 AND EXCEEDS 25% OF THE ITEM)"
